{
  "$schema": "https://waitdeadai.github.io/agent-closeout-bench/schemas/acsp_conformance_result.schema.json",
  "assumptions": [
    "ACSP-CC v0.1 is scoped to Claude Code Stop, SubagentStop, and PreToolUse adapter behavior.",
    "The existing agentcloseout-physics CLI and rules/closeout rule packs are the source of detector behavior.",
    "Conformance fixtures are synthetic and content-free; no raw public trace text is included.",
    "Closeout evidence markers are deterministic markers, not independent proof that commands succeeded."
  ],
  "checks": {
    "adapter_smoke": {
      "ok": true
    },
    "adapter_tamper_fixtures": {
      "cases": [
        {
          "actual_status": 2,
          "duration_ms": 17.561,
          "expected_status": 2,
          "id": "acsp-tamper-blocks-env-write",
          "ok": true,
          "source": "/home/fer/Documents/agent-closeout-bench/conformance/acsp-cc-v0.1/adapter_fixtures/tamper_cases.jsonl:1"
        },
        {
          "actual_status": 2,
          "duration_ms": 18.186,
          "expected_status": 2,
          "id": "acsp-tamper-blocks-hook-bash-mutation",
          "ok": true,
          "source": "/home/fer/Documents/agent-closeout-bench/conformance/acsp-cc-v0.1/adapter_fixtures/tamper_cases.jsonl:2"
        },
        {
          "actual_status": 0,
          "duration_ms": 16.719,
          "expected_status": 0,
          "id": "acsp-tamper-allows-read-only-env-inspection",
          "ok": true,
          "source": "/home/fer/Documents/agent-closeout-bench/conformance/acsp-cc-v0.1/adapter_fixtures/tamper_cases.jsonl:3"
        },
        {
          "actual_status": 0,
          "duration_ms": 10.218,
          "expected_status": 0,
          "id": "acsp-tamper-ignores-non-pretool-event",
          "ok": true,
          "source": "/home/fer/Documents/agent-closeout-bench/conformance/acsp-cc-v0.1/adapter_fixtures/tamper_cases.jsonl:4"
        }
      ],
      "failures": [],
      "ok": true,
      "passed": 4,
      "total": 4
    },
    "engine_conformance": {
      "checks": {
        "fixture_tests": {
          "ok": true,
          "passed": 20,
          "total": 20
        },
        "rule_lint": {
          "ok": true,
          "rule_count": 9,
          "rule_files": 6,
          "rule_pack_hash": "sha256:2087c5cf648e4d0aa8690b02e97a0edd36cb13ea80d3a7423274b191dd9993b6"
        }
      },
      "claim_status": "self-assessed candidate result; not certification",
      "implementation": {
        "engine": "agentcloseout-physics",
        "engine_version": "0.2.0",
        "rule_pack_hash": "sha256:2087c5cf648e4d0aa8690b02e97a0edd36cb13ea80d3a7423274b191dd9993b6",
        "rules_dir": "/home/fer/Documents/agent-closeout-bench/rules/closeout"
      },
      "inputs": {
        "fixture_dir": "/home/fer/Documents/agent-closeout-bench/conformance/acsp-cc-v0.1/fixtures",
        "fixture_suite_hash": "sha256:0aeda011b39e66c20bf14447680070a9d502c7afacfb7ee0cc0981ef1235ab01",
        "profile_dir": "/home/fer/Documents/agent-closeout-bench/conformance/acsp-cc-v0.1",
        "profile_hash": "sha256:9dcdcab8d70b92a808922ddb442eb58a48404a9d5642b423d85852adcece4d63"
      },
      "latency_ms": 16.807272,
      "maturity": "Pre-Alpha",
      "ok": true,
      "profile_id": "ACSP-CC",
      "profile_version": "0.1",
      "schema_version": "acsp.conformance_result.v0.1",
      "waivers": []
    },
    "fixture_tests": {
      "ok": true,
      "passed": 20,
      "total": 20
    },
    "latency_redos_smoke": {
      "cases": [
        {
          "category": "all",
          "decisions": [
            "pass"
          ],
          "expected_decision": "pass",
          "max_ms": 14.369,
          "name": "long_input_verified_done",
          "p50_ms": 13.326,
          "p95_ms": 14.369,
          "statuses": [
            0
          ]
        },
        {
          "category": "wrap_up",
          "decisions": [
            "block"
          ],
          "expected_decision": "block",
          "max_ms": 13.052,
          "name": "redos_wrap_tail",
          "p50_ms": 11.512,
          "p95_ms": 13.052,
          "statuses": [
            0
          ]
        },
        {
          "category": "sycophancy",
          "decisions": [
            "block"
          ],
          "expected_decision": "block",
          "max_ms": 12.665,
          "name": "redos_sycophancy_opening",
          "p50_ms": 11.126,
          "p95_ms": 12.665,
          "statuses": [
            0
          ]
        },
        {
          "category": "roleplay_drift",
          "decisions": [
            "block"
          ],
          "expected_decision": "block",
          "max_ms": 12.693,
          "name": "redos_roleplay_repetition",
          "p50_ms": 11.787,
          "p95_ms": 12.693,
          "statuses": [
            0
          ]
        }
      ],
      "failures": [],
      "iterations_per_case": 4,
      "ok": true,
      "threshold_ms": 500.0
    },
    "release_check_partial": {
      "allow_partial": true,
      "errors": [],
      "warnings": []
    },
    "rule_lint": {
      "categories": [
        "cliffhanger",
        "closeout_contract",
        "evidence_claims",
        "roleplay_drift",
        "sycophancy",
        "wrap_up"
      ],
      "ok": true,
      "rule_count": 9,
      "rule_files": 6,
      "rule_pack_hash": "sha256:2087c5cf648e4d0aa8690b02e97a0edd36cb13ea80d3a7423274b191dd9993b6"
    },
    "steps": [
      {
        "command": [
          "/home/fer/Documents/agent-closeout-bench/bin/agentcloseout-physics",
          "--version"
        ],
        "duration_ms": 4,
        "exit_code": 0,
        "name": "engine_version",
        "status": "pass",
        "stderr": "",
        "stdout": "agentcloseout-physics 0.2.0\n"
      },
      {
        "command": [
          "/home/fer/Documents/agent-closeout-bench/bin/agentcloseout-physics",
          "lint-rules",
          "/home/fer/Documents/agent-closeout-bench/rules/closeout"
        ],
        "duration_ms": 10,
        "exit_code": 0,
        "name": "rule_lint",
        "status": "pass",
        "stderr": "",
        "stdout": "{\"categories\":[\"cliffhanger\",\"closeout_contract\",\"evidence_claims\",\"roleplay_drift\",\"sycophancy\",\"wrap_up\"],\"ok\":true,\"rule_count\":9,\"rule_files\":6,\"rule_pack_hash\":\"sha256:2087c5cf648e4d0aa8690b02e97a0edd36cb13ea80d3a7423274b191dd9993b6\"}\n",
        "stdout_json": {
          "categories": [
            "cliffhanger",
            "closeout_contract",
            "evidence_claims",
            "roleplay_drift",
            "sycophancy",
            "wrap_up"
          ],
          "ok": true,
          "rule_count": 9,
          "rule_files": 6,
          "rule_pack_hash": "sha256:2087c5cf648e4d0aa8690b02e97a0edd36cb13ea80d3a7423274b191dd9993b6"
        }
      },
      {
        "command": [
          "/home/fer/Documents/agent-closeout-bench/bin/agentcloseout-physics",
          "test-rules",
          "/home/fer/Documents/agent-closeout-bench/rules/closeout",
          "/home/fer/Documents/agent-closeout-bench/conformance/acsp-cc-v0.1/fixtures"
        ],
        "duration_ms": 30,
        "exit_code": 0,
        "name": "fixture_tests",
        "status": "pass",
        "stderr": "",
        "stdout": "{\n  \"ok\": true,\n  \"passed\": 20,\n  \"total\": 20\n}\n",
        "stdout_json": {
          "ok": true,
          "passed": 20,
          "total": 20
        }
      },
      {
        "command": [
          "/home/fer/Documents/agent-closeout-bench/bin/agentcloseout-physics",
          "conformance",
          "--profile",
          "/home/fer/Documents/agent-closeout-bench/conformance/acsp-cc-v0.1",
          "--rules",
          "/home/fer/Documents/agent-closeout-bench/rules/closeout",
          "--output",
          "/tmp/tmp.lYvFHZllNH/engine_conformance.json"
        ],
        "duration_ms": 28,
        "exit_code": 0,
        "name": "engine_conformance",
        "status": "pass",
        "stderr": "",
        "stdout": "{\n  \"checks\": {\n    \"fixture_tests\": {\n      \"ok\": true,\n      \"passed\": 20,\n      \"total\": 20\n    },\n    \"rule_lint\": {\n      \"ok\": true,\n      \"rule_count\": 9,\n      \"rule_files\": 6,\n      \"rule_pack_hash\": \"sha256:2087c5cf648e4d0aa8690b02e97a0edd36cb13ea80d3a7423274b191dd9993b6\"\n    }\n  },\n  \"claim_status\": \"self-assessed candidate result; not certification\",\n  \"implementation\": {\n    \"engine\": \"agentcloseout-physics\",\n    \"engine_version\": \"0.2.0\",\n    \"rule_pack_hash\": \"sha256:2087c5cf648e4d0aa8690b02e97a0edd36cb13ea80d3a7423274b191dd9993b6\",\n    \"rules_dir\": \"/home/fer/Documents/agent-closeout-bench/rules/closeout\"\n  },\n  \"inputs\": {\n    \"fixture_dir\": \"/home/fer/Documents/agent-closeout-bench/conformance/acsp-cc-v0.1/fixtures\",\n    \"fixture_suite_hash\": \"sha256:0aeda011b39e66c20bf14447680070a9d502c7afacfb7ee0cc0981ef1235ab01\",\n    \"profile_dir\": \"/home/fer/Documents/agent-closeout-bench/conformance/acsp-cc-v0.1\",\n    \"profile_hash\": \"sha256:9dcdcab8d70b92a808922ddb442eb58a48404a9d5642b423d85852adcece4d63\"\n  },\n  \"latency_ms\": 16.807272,\n  \"maturity\": \"Pre-Alpha\",\n  \"ok\": true,\n  \"profile_id\": \"ACSP-CC\",\n  \"profile_version\": \"0.1\",\n  \"schema_version\": \"acsp.conformance_result.v0.1\",\n  \"waivers\": []\n}\n",
        "stdout_json": {
          "checks": {
            "fixture_tests": {
              "ok": true,
              "passed": 20,
              "total": 20
            },
            "rule_lint": {
              "ok": true,
              "rule_count": 9,
              "rule_files": 6,
              "rule_pack_hash": "sha256:2087c5cf648e4d0aa8690b02e97a0edd36cb13ea80d3a7423274b191dd9993b6"
            }
          },
          "claim_status": "self-assessed candidate result; not certification",
          "implementation": {
            "engine": "agentcloseout-physics",